1288	I just don't know what to say.	513737	من فقط نمی دانم چه بگویم.
1294	Education in this world disappoints me.	513749	آموزش در جهان من را نا امید کرده است.
1312	I'm going to go.	717587	می خواهم بروم.
1329	Hurry up.	510489	عجله کن!
1356	This is always the way it has been.	563961	کارها همیشه به این قرار بود.
1427	No, he's not my new boyfriend.	739870	نه، او دوست‌پسر جدید من نیست.
1434	I love you.	516949	عاشقتم
1434	I love you.	559032	من ترا دوست دارم.
1434	I love you.	1810629	من عشق تو هستم.
1435	I don't like you anymore.	778458	من دیگر تو را دوست ندارم.
1482	I don't speak Japanese.	554314	من ژاپنی صحبت نمی‌کنم.
1484	Nobody understands me.	554316	هیچکس مرا درک نمی‌کند.
1485	I learned to live without her.	554317	یاد گرفتم که بدون او زندگی کنم.
1486	It's useless to keep on thinking any more.	554320	فکر کردن دیگر فایده‌ای ندارد.
1487	I have too many things on my mind these days.	554321	این روزها افکار زیادی در سر دارم.
1488	I just wanted to check my email.	554322	فقط می‌خواستم ایمیلم را چک کنم.
1489	Do you really need to ask the question to know the answer?	554343	آیا برای فهمیدن جواب حتماً باید سؤال بپرسی؟
1490	You can't expect me to always think of everything!	554344	نباید همیشه انتظار داشته باشی که من فکر همه چیز را بکنم!
1491	I suppose that behind each thing we have to do, there's something we want to do...	554346	به نظر من، در ورای هر چیزی که مجبور به انجام دادنش هستیم، چیزی هست که مایل به انجام آن هستیم…
1492	You really don't have the right priorities!	554347	شما واقعاً واجد اولویت‌های مناسب نیستید!
1493	Don't expect others to think for you!	554348	انتظار نداشته باشید که دیگران به جای شما فکر کنند!
1494	You never have time for important things!	554349	تو هیچگاه برای چیزهای مهم وقت نداری!
1508	"What's going on in the cave? I'm curious." "I have no idea."	916272	" در این غار چه می گذرد؟ من کنجکاو هستم." "من هیچ حدسی نمی زنم."
1518	"Thank you for helping me." "Don't mention it."	916197	"ممنون برای کمکتان." "قابلی نداشت."
1590	Do you speak Italian?	786210	ایتالیایی صحبت می‌کنی؟
1684	If you don't want to put on sunscreen, that's your problem. Just don't come complaining to me when you get a sunburn.	916192	اگر تو نمی خواهی ضد آفتاب بزنی مشکل خودت است. پس دیگر از آفتاب سوختگی پیش من شکایت نکن.
1819	You did this intentionally!	2195746	از قصد این کار رو کردی.
1831	I can't cut my nails and do the ironing at the same time!	674425	من قادر نیستم همزمان ناخن هایم را کوتاه کنم و اتو بزنم!
1852	What is your greatest source of inspiration?	849099	منبع بزرگ الهام گرفتنت چیست؟
1866	People who love doubt nothing, or doubt everything.	667828	مردم دوست دارند یا به هیچ چیز شک نکنند یا به همه چیز شک کنند.
2037	You had plenty of time.	805133	تو وقت زیادی داشتی.
2066	What are you talking about?	672774	درباره چه حرف می زنید؟
2192	You have been thinking about this problem the whole morning. Take a break; go eat lunch.	848156	تو روی این مسئله تمام صبح فکر کرده ای. استراحتی کن و ناهار بخور.
2219	Open the cupboard to the left, the bottles are in there.	2369970	در سمت راست قفسه را باز کن.بطری ها در آنجا قرار دارند
2222	I suggest that we go out on Friday.	2441172	من پیشنهاد می کنم جمعه بیرون برویم.
2249	I need your advice.	610698	من به مشوت شما احتیاج دارم.
2271	Death is only a horizon, and a horizon is nothing save the limit of our sight.	786262	مرگ تنها یک افق است؛ و افق چیزی بیش از حد دید ما نیست.
2277	Until you make peace with who you are, you'll never be content with what you have.	2095037	تا زمانی که با خود، سازش نکرده ای، هرگز نسبت به آنچه که داری، راضی نخواهی شد.
2348	The early bird catches the worm.	2165592	زود بری بهتر گیرت میاد
2394	It was raining when we left, but by the time we arrived, it was sunny.	704974	وقتی که بیرون آمدیم باران می آمد، اما حدود زمانی که رسیدیم آفتابی بود.
2409	I went to drink a beer with friends.	667978	من برای نوشیدن آبجو با دوستانم بیرون رفتم.
2438	The film started at 2 o'clock.	1903695	فیلم ساعت دو شروع شد.
6019	I work even on Sunday.	1486332	من حتی روزهای یکشنبه هم کار می کنم.
9602	Are you not tired?	644162	آیا خسته نیستی؟
15830	You should tell him the truth.	1440449	شما باید حقیقت را به او بگویید
15863	You should work hard.	848076	تو باید سخت کار کنی.
16029	Do you know how to use a dictionary?	1758603	آیا بلدید چگونه از لغت نامه استفاده کنید؟
16107	Your hair wants cutting.	667746	بایست موهایت کوتاه شوند.
16292	Can you make yourself understood in English?	773800	می‌توانید به زبان انگلیسی منظورتان را بفهمانید؟
16301	You can't swim, can you?	1601522	نمی توانی شنا کنی، می تونی؟
16491	How about you?	1005079	تو چطور؟
16500	Why did you say such a thing?	667982	برای چه چنین چیزی گفتی؟
16536	You are old enough to know better than to act like that.	960932	تو آنقدر بزرگ شده ای که بدانی بهتر از آن باید رفتار کنی.
16659	You're forever making mistakes.	654632	تو به طور مکرر اشتباه می کنی.
16739	You should ask your father for his advice and follow it.	764831	تو باید از پدرت راهنمایی بخواهی و به آن عمل کنی.
17013	Go back to your seat.	1558419	به صندلی خود برگرد.
17103	Is your watch correct?	588612	آیا ساعتت درست است؟
17116	Just follow your heart.	752374	به سادگی از قلبت پیروی کن.
17212	I think you're right.	752269	فکر می کنم حق با توست.
17532	I expect you know all about it.	944991	انتظار دارم همه چیز را راجع به آن بدانی.
17568	I'll treat you.	588439	من از تو مراقبت خواهم کرد..
17596	I as well as you am to blame.	2179056	منم به اندازه تو مقصر هستم.
17606	It is hard to distinguish you from your brother.	509650	تشخیص دادن تو از برادرت دشوار است.
17622	I would prefer to speak to you in private.	756739	من ترجیح می دادم که به طور خصوصی با شما سخن بگویم.
17642	All of you did good work.	1569557	کار همه‌تان خوب بود.
17849	Nothing is so tasty as the dish you make.	624505	هیچ چیزی به اندازه ی غذایی که درست می کنی خوشمزه نیست.
17897	I do not for a moment think you are wrong.	2179053	حتی برای یک لحظه فکر نمی کنم که اشتباه می کنی.
18055	We will miss you badly.	773838	بدجوری دلمان برایت تنگ خواهد شد.
18057	It is because you work too much that you are sleepy all the time.	666602	به این دلیل که تو بسیار کار می کنی، همیشه خواب آلود هستی.
18088	Are my socks dry already?	666613	آیا جوراب هایم خشک شده اند؟
18235	Air is a mixture of gases.	866474	هوا مخلوطی از گازها است.
18328	Many stars were shining in the heavens.	588578	ستاره های بسیاری در آسمان می درخشیدند.
18345	Seen from the sky, the bridge appears more beautiful.	2178988	اگه از بالا ببینی این پل خیلی قشنگ تر به نظر میاد.
18484	Is there a table available for two on Friday?	915315	آیا میزی برای دو نفر در روز جمعه وجود دارد؟
18491	To make money is not the purpose of life.	773693	پول در آوردن هدف زندگی نیست.
18494	A blonde is speaking to her psychiatrist.	773689	یک زن بلوند با روانپزشکش صحبت می‌کند.
18550	The gold coin was much more valuable than was supposed.	915316	سکه طلا از آنچه که تصور می شد، ارزش بیشتری داشت.
18581	Money ruins many.	1583153	پول بسیاری را فاسد می کند.
18628	Too much money?	915317	پول خیلی زیاد؟
18632	Little money, few friends.	915318	پول کم، دوستان کم.
18637	Money enables you to buy anything.	915319	پول شما را قادر می سازد تا هر چیزی را بخرید.
18640	Prices have been gradually rising in recent years.	915320	قیمت ها به تدریج در طی سالهای اخیر افزایش یافته اند.
18680	I have seen little of him of late.	915321	اخیراً، او را به ندرت دیده ام.
18856	Slight inattention can cause a great disaster.	2166077	کوچک ترین بی توجهی ممکنه به فاجعه ختم بشه
18881	Astonishment deprived me of speech.	912551	از شدت تعجب زبانم بند آمد.
19031	It is the students' duty to clean their classrooms.	696547	این وظیفه دانش آموزان است که کلاسهایشان را تمیز کنند.
19047	Get out of the classroom.	2761300	گمشو از کلاس بیرون.
19094	Let's pass by the church.	634904	بگذار از کنار کلیسا بگذریم.
19180	The strong wind died away at night.	2178984	باد شدید شب قطع شد.
19272	Effectively dealing with competition is an important part of life.	554395	مواجهه‌ی مؤثر با مسئله‌ی رقابت بخش مهمی از زندگی محسوب می‌شود.
19454	Add a little milk.	823718	کمی شیر اضافه کن.
19533	His low salary prevents him from buying the house.	822323	حقوق کم او او را از خانه خریدن باز می دارد.
19627	Suddenly rain began to fall.	644139	ناگهان باران باریدن گرفت.
19640	Hurry, and you will catch the train.	829505	عجله کن، تا به قطار برسی.
19664	Hurry up, or you will be late.	705474	عجله کن، وگرنه دیر خواهی کرد.
19673	Hurry up, and you will be on time.	829004	عجله کن، تا به موقع برسی.
19705	You make mistakes if you do things in a hurry.	2441151	اگر در انجام کار ها عجله کنی، اشنباه می کنی
19810	The holiday ended all too soon.	654667	تعطیلات خیلی زود تمام شد.
20025	The chances are that the bill will be rejected.	829012	هرچه شانس بود بیل از دست داد.
20297	I don't feel well. Could you give me some medicine?	764224	حالم خوب نیست.می شود مقداری دارو به من بدهی؟
20344	Take it easy.	823712	آسان بگیرش.
20393	Never mind. Anyone can make mistakes.	2441152	اشکالی ندارد. همه می توانند اشتباه کنند.
20602	Several newspapers published the story.	679291	مجلا ت گونا گونی آن داستان را منتشر کردند.
20776	I try.	3653820	امتحان میکنم
20776	I try.	3653823	تست میکنم
20820	The countries concerned settled the dispute by peaceful means.	2095041	کشورهای ذیربط، اختلاف را از طریق ابزارهای مسالمت آمیز حل و فصل نمودند.
20864	People who are afraid of making mistakes will make no progress in English conversation.	2441148	کسانی که از اشتباه کردن می ترسند،نمی توانند در مکالمه انگلیسی پیشرفت کنند
20871	Don't worry about making mistakes.	2441153	نگران اشتباه کردن نباش.
21155	The cold weather continued for three weeks.	2379533	هوای سرد تا سه هفته ادامه یافت.
21260	Do you play a musical instrument?	667772	آیا تو سازی موسیقیایی می نوازی؟
21263	After a storm comes a calm.	1044805	پس از طوفان، آرامش گسترده می‌گردد.
21552	The school is two kilometers ahead.	654616	مدرسه دو کیلومتر به سمت جلو است.
21644	The more you study, the more you discover your ignorance.	654623	هر چه بیشتر بخوانی، بیشتر به نادانیت پی می بری.
21850	Don't make fun of foreigners.	1780290	خارجی ها را مسخره نکن.
21864	I'd rather stay home than go out.	2019276	ترجیح می دهم در خانه بمانم تا اینکه بیرون بروم.
21914	I will show you a new approach to foreign language learning.	778460	من شیوه ای نو برای یادگیری زبان نشانت می دهم.
21956	We have to buy them from abroad.	809595	باید آنها را از خارج بخریم.
22225	The sea was as smooth as glass.	773714	دریا مثل شیشه صاف بود.
22248	I cast my net into the sea.	529206	من تور ماهیگیری ام را به درون دریا انداختم.
22386	The community is made up of individuals.	654653	جامعه متشکل از اشخاص است.
22447	The date and place of the meeting have been fixed.	753622	تاریخ و زمان جلسه ثابت و معین شده است.
22559	Absence makes the heart grow fonder.	1044790	دوری باعث علاقمندی می شود.
22559	Absence makes the heart grow fonder.	1044791	دوری و دوستی.
22670	We must preserve our peaceful constitution.	2095044	ما باید قانون اساسی صلح آمیز خود را حفظ کنیم.
22674	We are a peace-loving nation.	2095045	ما ملت صلح دوستی هستیم.
22675	We are working in the interest of peace.	2095046	ما در جهت صلح تلاش می کنیم.
22753	We came to the conclusion that we should help him.	563939	ما به این نتیجه رسیدیم که باید به او کمک کنیم.
22868	We are longing for world peace.	2095047	ما مشتاق صلح جهانی هستیم.
22869	We are anxious for world peace.	2095049	ما به شدت خواهان صلح جهانی هستیم.
22870	We should make every effort to maintain world peace.	2095052	ما باید هر گونه تلاشی را جهت حفظ صلح جهانی انجام دهیم.
22880	We talked in sign language.	907859	ما با زبان اشاره صحبت کردیم.
23052	We set out on our journey full of hope.	2762563	ما سفرمان را با پر از آرزو شروع کردیم ( میکنیم)
23214	We got all the materials together.	1440446	ما تمام مواد را یکجا بدست آوردیم
23296	We have enjoyed peace for more than forty years.	2095057	ما بیش از 40 سال است که از صلح برخوردار شده ایم.
23420	Our project collapsed.	829391	پروژه ی ما زمین گیر شده است.
23432	Our ultimate goal is to establish world peace.	2095058	هدف غایی ما برقراری صلح جهانی است.
23620	It is considered impossible to travel back to the past.	640142	سفر کردن به گذشته مسئله ای غیر ممکن تلقی شده است.
23817	In case of fire, you should dial 119.	1849174	در صورت آتش سوزی، شما باید با شماره 119 تماس بگیرید.
23818	In case of a fire, use this emergency stairway.	822313	به هنگام آتش سوزی از پله های اضطراری استفاده کنید.
23884	There is no smoke without fire.	1061405	تا نباشد چیزکی، مردم نگویند چیزها.
23897	The fire is going out; will you add some wood?	752739	آتش دارد خاموش می شود.می توانی کمی چوب اضافه کنی؟
24043	I have peace at home.	2095059	من در خانه آرامش دارم.
24147	The house was in flames.	1567931	خانه شعله ور شده بود.
24174	I had to help with the housework.	773713	می‌بایست در کارهای خانه کمک کنم.
24457	After a couple of drinks, the guy was feeling no pain.	1758670	بعد از چند نوشیدنی، دیگر آن مرد دردی احساس نمی کرد.
24542	Many kinds of birds live in Japan.	888551	در ژاپن، پرنده های گوناگون می زیند.
24561	A fox is not caught twice in the same snare.	588644	یک روباه دوبار در یک دام نمی افتد.
24789	Above all, be patient.	839446	بالاتر از هر چیز این است که صبور باشی.
24840	It is good for nothing.	2512958	به هیچ دردی نمی خورد.
25013	I want something cold to drink.	705051	من چیزی سرد برای نوشیدن می خواهم.
25164	What's up?	691619	چه خبر؟
25321	If it were to rain tomorrow, the match would be postponed.	731258	اگر قرار بود فردا باران ببارد، مسابقه به تعویق می‌افتاد.
25356	I got soaked to the skin.	1883244	تا مغز استخوان خیس شدم.
25394	Musicians are usually sensitive to criticism.	1888888	موسیقی‌دانان معمولاً نسبت به انتقاد حساس هستند.
25450	Don't make any noise, I'm studying.	535048	سر و صدا ایجاد نکن, من دارم مطالعه می کنم
25471	The temperature falls.	827410	تب پایین آمده است.
25571	The roof is really in need of repair.	752274	پشت بام واقعا به تعمیر احتیاج دارد.
25740	Could you pass me the salt, please?	705460	می شود به من نمک را بدهی، لطفا؟
25741	Please pass me the salt.	705459	لطفا نمک را به من بده.
25742	Pass me the salt, would you?	705463	نمک را به من بده، ممکنه؟
25755	Pass me the salt and pepper, please.	705470	نمک و فلفل را بگردان، لطفا.
25756	We season with salt.	705468	ما با چاشنی نمک طعم می دهیم.
25757	I wanted some salt, but there was none in the jar.	705472	من نمک می خواستم، ولی در بطری شیشه ای هیچ نبود.
25824	I saw a light in the distance.	705033	من از دور یک روشنایی دیدم.
25825	I could see Tokyo Tower far away.	773668	برج توکیو را می‌توانستم در دوردست ببینم.
25977	It's too far to walk to the station, so let's take a bus.	805159	پیاده روی تا ایستگاه طولانی است پس بیا سوار اتوبوس شویم.
26229	Learning English is hard work.	805162	یادگیری زبان انگلیسی کار سختی است.
26275	English has become an international language.	752280	انگلیسی به یک زبان بین المللی تبدیل شده است.
26365	It is difficult to express one's thoughts in English.	1545688	بیان افکار به زبان انگلیسی دشوار است.
26422	Permanent peace is nothing but an illusion.	2095061	صلح پایدار چیزی نیست بجز یک توهم.
26467	I think a movie is more entertaining than any book.	510625	من فکر می کنم که یک فیلم بیشتر از یک کتاب سرگرم کننده است.
26817	The rain whipped against the window.	656642	باران به پنجره تازیانه می زد.
26897	Let's go back before it begins to rain.	772524	بیا برگردیم قبل از آنکه باران باریدن بگیرد.
27105	I'll explain how to take this medicine.	1558404	من توضیح خواهم داد که چگونه این دارو را مصرف کنید.
27173	Ichiro puts friendship above profit.	829406	ایچارو دوستی را بالاتر از منفعت می داند.
27468	Don't attempt two things at a time.	510507	در یک زمان برای دو چیز تلاش نکن.
27504	What on earth are you doing here?	1044585	اینجا داری چی کار می کنی؟
27567	He worked hard.	699254	خیلی سخت کار می کرد.
27703	She told him once and for all that she would not go to the movie with him.	773861	آن زن یک بار برای همیشه به او گفت که با او به سینما نخواهد رفت.
27919	The doctor told her that she should take a rest.	1519602	دکتر به او گفت او باید استراحت کند.
28024	A good doctor follows his own directions.	402865	دکتر خوبی کسی است که به راهنمایی های خودش عمل کند.
28107	Being a doctor helped me greatly during the journey.	2566509	دکتر بودنم در طی سفر به من کمک بزرگی کرد.
28205	I lost consciousness.	509653	من هوشیاری ام را از دست دادم.
28258	The committee was split over the project.	1888879	اعضای کمیته در مورد پروژه دو دیدگاه متفاوت داشتند.
28316	Have you met her before?	588600	قبلا او را دیده بودی؟
28345	There used to be a green field here; now there's a supermarket.	731255	اینجا قبلا یک مزرعه‌ی سرسبز بود، ولی حالا یک سوپرمارکت است.
28791	We are not born for ourselves.	753543	ما برای خودمان به دنیا نیامده ایم.
28802	We discussed the matter with each other.	1624227	ما مساله را با یکدیگر مورد بررسی قرار دادیم.
28972	I want to go with you.	822367	می خواهم با تو بیایم.
28997	I'm learning how to type.	805058	من دارم یاد می گیرم که چگونه تایپ کنم.
29020	I prefer coffee to tea.	705473	قهوه را به چای ترجیح می دهم.
29047	I exempted her from working overtime.	1609781	من او را از اضافه کار معاف کردم.
29064	Do you think that my way of teaching is wrong?	510464	آیا فکر میکنی که روش درس دادن من اشتباه است؟
29071	I have a friend whose father is a famous pianist.	761090	من دوستی دارم که پدرش پیانیست مشهوری است.
29168	We made a contract with the firm.	1758634	ما با شرکت قرارداد بستیم.
29228	There is little wine left.	848148	کمی شراب باقی مانده است.
29244	If you had a word processor, you'd be free from all this trouble.	907911	اگر یک واژه‌پرداز می‌داشتید، از تمام این دردسرها خلاص می‌شدید.
29315	I need a lot of cloth to make a long dress.	822340	من برای درست کردن یک لباس بلند به مقدار زیادی پارچه احتیاج دارم.
29329	Lobsters belong to a class of marine animals.	644133	میگو به دسته ی حیوانات دریایی تعلق دارد.
29350	Which do you like better, rock music or classical music?	773712	از کدامیک بیشتر خوشتان می‌آید، موسیقی راک یا موسیقی کلاسیک؟
29466	The candle went out by itself.	786233	شمع خود به خود خاموش شد.
29490	A tea with lemon, please.	1674334	یک چای با لیمو، لطفاً.
29771	The radio was invented by Marconi.	3033664	رادیو توسط مارکونی اختراع شد.
29826	Please turn off the light.	653815	لطفا چراغ را خاموش کن.
29918	Barking dogs seldom bite.	2398423	سگهایی که پارس می کنند، بندرت گاز می گیرند.
30006	Good. No absentees.	907888	خوب است. غایب نداریم.
30206	I've told you over and over again not to do that.	2171606	بارها و بارها بهت گقتم این کار رو نکن.
30371	You're old enough to know better.	1757134	تو به اندازه کافی بزرگ هستی، که بیشتر بدانی.
30374	I wish I had more time to talk with her.	1569547	کاش وقت بیشتری برای حرف زدن با او داشته باشم.
30420	Sorry I didn't e-mail you sooner.	1871907	ببخشید که زودتر به شما ایمیل نزدم.
30494	The brightest student expressed gratitude on behalf of his classmates.	1888896	با هوش‌ترین دانش‌آموز از طرف همکلاسی‌هایش ابراز تشکر کرد.
30580	If you can't keep your promise, what excuse will you make?	554428	اگر نتوانی به وعده‌ات عمل کنی، چه عذری خواهی آورد؟
30935	If he wanted to get to London today, he should leave now.	2379531	اگر بخواهد امروز به لندن برسد، باید همین الان برود.
30946	If peace cannot be maintained with honor, it is no longer peace.	2095023	اگر صلح را نتوان با شرافت حفظ کرد، این دیگر صلح نیست.
31020	If you will lend me the money, I shall be much obliged to you.	563912	اگر به من پول قرض بدهی،من بیشتر نسبت به تو وفادار خواهم شد.
31169	I won't talk with him anymore.	1515600	دیگر با او صحبت نخواهم کرد.
31377	It was really good.	651352	واقعا خوب بود.
31439	I'm done up.	2170229	دیگه نمی تونم ادامه بدم.
31528	Would you like another piece of cake?	2174758	یک تکه‌ی کیک دیگر میل دارید؟
31572	It's about time for the train to arrive.	564183	الآن تقریبا زمانی است که قطار می رسد.
31804	Meg looks pleased with her new dress.	860884	به نظر میرسد مگ از لباس جدیدیش راضی است.
31821	Meg talks too much.	402861	مگ آدم پر حرفی است.
31823	Meg is as tall as Ken.	402862	مگ هم قد کن است.
31824	Meg's shoes are a little loose.	402863	کفش های مگ کوچک شده اند.
