470840	The red lines on the map represent a railway.	561513	خطوط قرمز روی نقشه راه آهن را نشان میدهند.
471261	As far as I know, this is the only translation available.	566326	این که تنها ترجمه ی موجود است،دور از ذهن من بود.
471325	To the best of my knowledge, she hasn't left yet.	2170224	تا جایی که می دونم هنوز نرفته
471483	The shirt needs ironing.	866433	این پیراهن نیاز به اتو دارد.
471872	That is my dictionary.	507973	این لغت نامه ی من است.
472089	I go to school.	2904456	به مدرسه می روم.
473820	Look behind you!	510514	پشت سرت را نگاه کن!
475907	It's still too early to talk about this now.	916235	الآن هم هنوز زود است که راجع به آن صحبت کنیم.
476469	Open the door a bit!	822585	در را کمی باز کن!
476491	He has ambition, so he works hard.	704980	او بلند پروازی دارد، به همین دلیل سخت کار می کند.
477053	Pakistan is a Muslim country.	739767	پاکستان یک کشور اسلامی است.
477067	If you sign up to Facebook, your information will be sent to intelligence agencies.	739766	اگر در فیسبوک ثبت‌نام کنید، اطلاعات شما برای سازمان‌های جاسوسی فرستاده خواهد شد.
477120	I was your inspiration for this sentence, and you know it.	739761	خودت می‌دانی که این جمله را از من الهام گرفتی.
477261	I work every day but Sunday.	829495	من هر روز به جز یکشنبه کار می کنم.
477323	Mary helped her mother with the cooking.	764834	ماری به مادرش در آشپزی کمک کرد.
477369	The sun is red.	1184089	آفتاب قرمز است.
477387	Don't leave me!	510630	منو ترک نکن!
478255	He closed the door.	752500	او در را بست.
479197	The Jabulani is the official match ball of the 2010 FIFA World Cup.	535064	جابولانی توپ رسمی بازی جام جهانی 2010 است.
479759	It's not rocket science.	1609787	کار چندان سختی نیست.
481057	Where's the nearest train station?	2178409	نزدیکترین ایستگاه قطار کجاست؟
482309	These two cities have the same traffic rules.	656662	این دو شهر قوانین رفت و آمد یکسان دارند.
483280	Precisely!	1454457	دقیقاً!
484151	Come sit with us.	752724	بیا با ما بنشین.
489167	Her daughter has become a beautiful woman.	1883240	دختر او به زن زیبایی تبدیل شده است.
490881	I forgot his name.	756328	نام او را فراموش کردم.
491716	He pretended that he was a lawyer.	822245	او مدعی بود که او یک وکیل است.
495621	The whole family was sick in bed.	866475	کل خانواده در بستر بیماری افتاده بودند.
495660	Do you have some good medicine?	920582	شما داروی مناسبی دارید؟
499594	The Leaning Tower of Pisa is taller than the church.	1454447	برج خمیده پیزا از کلیسا بلندتر است.
500514	You can adjust game configuration options when starting the game for the first time.	1584105	شما می توانید گزینه های پیکره بندی بازی را در هنگام شروع بازی برای اولین بار، تنظیم نمایید.
502380	The world follows one golden rule: whoever has the gold makes the rules.	828518	دنیا از یک قانون طلائی پیروی می‌کند: هر کسی که طلا دارد، قوانین را می‌سازد.
505445	That man is a man content with his fate.	1485574	آن مرد، مردی است که از سرنوشت خويش راضی است.
505657	Hello, how are you doing?	505651	سلام حالت چطوره؟
505657	Hello, how are you doing?	528889	سلام،حال شما چه طور است؟
505937	Hi, are you OK?	505905	من فردا هرات ميرم
506233	Please forgive me for opening your letter by mistake.	798640	ببحشید که من اشتباهاً نامه‌ی شما را باز کردم.
506445	This is impossible!	506697	این غیر ممکن!
506446	Don't worry.	506696	نگران نباش.
506447	I don't understand this.	506694	من متوجه نشدم.
506450	China is bigger than Japan.	506693	چین بزرگتر از ژاپن است.
506451	I came here yesterday.	506692	من دیروز آمدم اینجا.
506453	I got a letter from my friend.	506691	من یک نامه از دوستم دریافت کردم.
506454	We have two children.	506690	ما دو بچه داریم.
506455	Tony and I played together yesterday.	506688	من و تونی دیروز با هم بازی کردیم.
506460	Tomorrow is Sunday.	506687	فردا یکشنبه است.
506606	What is your sister doing now?	506686	خواهرت الان چه کار می کند؟
506870	I've always hated biology.	829007	من همیشه از زیست شناسی متنفر بودم.
507506	She will give birth to a child next month.	1527101	ماه آینده کودک او متولد خواهد شد.
507744	A real friend is like a rare bird.	507959	یک دوست واقعی همانند پرنده ای کم نظیر است.
507748	Don't take it so seriously.	507960	زیاد جدی نگیر.
508844	The dog is dead.	511212	اين سگ مرده است.
508918	Her birthday party will be tomorrow evening.	509106	جشن تولدش فردا عصر برگزار میشه
508976	She tried to get a tent, but she couldn't find the one she wanted.	509105	او سعی کرد یک چادر پیدا کند اما نتوانست آنچه را که می خواست بیابد
509747	I don't remember the last time I climbed a tree.	510485	آخرین باری که من از درخت بالا رفتم را به یاد نمی آورم.
509927	It's not my business.	509933	آن به من ربطی ندارد
509927	It's not my business.	509945	این به من ربطی ندارد
509927	It's not my business.	509958	این به من مربوط نیست.
510225	You can learn about advanced search features here.	598029	شما اینجا تمام مشخصه های جستجوی پیشرفته را فرا می گیرید.
510255	Will a day come when we see them overthrown?	512885	آیا روزی خواهد شد تا سقوطشان را ببینیم؟
510304	I've never said that!	786193	من هرگز آن را نگفتم.
510389	Hi. How are you?	506700	سلام حال شما چطوره
510389	Hi. How are you?	528896	سلام، حالت چه طوره؟
511805	The N8 will be the first device by Nokia with the Symbian^3 operating system.	511892	N8 اولین دستگاه تولید شده بوسیله نوکیا با سیستمِ عِامل سیمبیان 3 خواهد بود.
512518	Road traffic injuries are a major public health problem and a leading cause of death.	631539	صدمات ناشی از آمد وشد جاده ای یکی از مشکلات عمده ی سلامت عمومی است و منجر به مرگ ومیر می شود.
509645	I can't say I share your enthusiasm for the idea.	705679	نمی توانم بگویم که در شور و اشتیاقت برای این ایده سهیم هستم.
512886	We hope to reach the summit before it gets dark.	512902	امیدواریم قبل از آنکه هوا تاریک شود به قله برسیم.
512913	My father always took me to school when I was young.	512947	پدر من همیشه مرا به مدرسه می رساند وقتی که من کوچک بودم.
513040	Hi, to all good Iranian children.	513039	سلام به همه بچه های خوب ایرانی.
513077	I'm scared of big, black, hairy tarantulas!	513723	من از رطیل های بزرگ سیاه پشمالو می ترسم.
513667	Everybody knows the moon is made of cheese.	823722	همه می دانند که ماه از پنیر ساخته شده است.
513906	Long live the Persian language!	513903	زنده باد زبان فارسی!
515085	What is love?	828129	عشق چیست؟
515533	They say that a large dam will be built.	706458	آنها می گویند که سد بزرگی ساخته خواهد شد.
516338	The Chavez family joined thousands of other farm workers who traveled around the state of California, to harvest crops for farm owners.	866450	خانواده‌ی چاوز به هزاران کارگر مزرعه‌ی دیگر پیوستند که در سرتاسر کالیفرنیا سفر می‌کردند تا محصول را برای مزرعه‌داران برداشت کنند.
516607	Hurry! There's no time to lose.	2761379	عجله کن! وقتی برای تلف کردن نداریم!
516619	What was the hotel called? I can't remember.	1030294	نام آن هتل چه بود؟ یادم نمی آید.
516622	This book is mine.	1044693	این کتاب مال من است.
518630	Wherever you go, I will follow.	518697	هر جا که بروی، من دنبالت می آیم.
518927	The people who were here have all gone.	1888914	افرادی که اینجا بودند، همه رفته‌اند.
520099	And they shall beat their swords into plowshares, and their spears into pruninghooks: nation shall not lift up sword against nation, neither shall they learn war any more.	521639	مردم از شمشیرهای خود گاوآهن و از نیزه های خود ارّه می سازند. قومی به روی قوم دیگر شمشیر نمی کشد و برای جنگ و خونریزی آماده نمی شود.
520099	And they shall beat their swords into plowshares, and their spears into pruninghooks: nation shall not lift up sword against nation, neither shall they learn war any more.	521640	و آنان‌ شمشیرهای‌ خود را به‌ گاو آهن‌ و نیزه‌های‌ خویش‌ را به‌ اره‌ تبدیل‌ خواهند كرد. قوم‌های‌ دنیا دیگر در فكر جنگ‌ با یكدیگر نخواهند بود.
520099	And they shall beat their swords into plowshares, and their spears into pruninghooks: nation shall not lift up sword against nation, neither shall they learn war any more.	521641	و ایشان‌ شمشیرهای‌ خود را برای‌ گاوآهن‌ و نیزه‌های‌ خویش‌ را برای‌ ارّه‌ها خواهند شكست‌ و امّتی‌ بر امّتی‌ شمشیر نخواهد كشید و بار دیگر جنگ‌ را نخواهند آموخت‌.
520099	And they shall beat their swords into plowshares, and their spears into pruninghooks: nation shall not lift up sword against nation, neither shall they learn war any more.	528847	و ایشان از شمشیرهایشان گاوآهن و از نیزه هایشان اره های نجاری ساختند:نه ملتی بر دیگر ملت شمشیر خواهد کشید ونه آنها بیش از این،جنگ کردن خواهند آموخت.
522309	His unique perspective helped shed light on the situation.	2188360	دید منحصر به فردش کمک کرد وضعیت رو بهتر بفهمیم.
523271	He was very patient.	788071	او خیلی صبور بود.
523377	Your message has been received.	523372	پیام دریافت شد
529830	Don't tell anyone this.	772534	به هیچ کس این را نگو.
531518	He had gone to the airport to meet Mr West.	772518	او به فرودگاه رفته بود تا با آقای وست ملاقات کند.
532669	Cut the salmon into small pieces.	1601521	ماهی سالمون را به قطعات کوچک ببر.
534198	If the life and death of Socrates was the life and death of a wise man, then the life and death of Jesus is the life and death of a God.	2095070	اگر حیات و مرک سقراط، حبات و مرگ یک انسان خردمند باشد، پس حیات و مرگ مسیح نیز حیات و مرگ یک خداوند است.
534295	That experiment led to a great discovery.	756757	این آزمایش منجر به کشف بزرگی شد.
534970	Thanks a lot!	1527115	خیلی متشکرم.
535793	To catch the bull, grab its horns.	1888875	برای گرفتن گاو، شاخ‌هایش را بگیرید.
536959	Isn't a problem at all, is it?	1624233	اصلاً مشکلی نیست، هست؟
537917	It's all just a big misunderstanding.	538628	همه اش تنها یک سوء تفاهم بزرگ است.
538053	This program has both downloading and uploading capabilities.	538635	این برنامه قابلیت دانلود و آپلود، هر دو را دارد.
538123	Hi.	505873	سلام
540279	I am trying to learn English.	540241	من به شدت تلاش مي كنم كه زبان انگليسي ياد بگيرم
548586	Forwards! Without stopping without fearing!	1757147	به جلو! بدون توقف، بدون ترس.
550928	You can use my car if you like.	2019277	اگر تمایل داری می توانی از خودرو من استفاده کنی.
551443	No problem.	1808519	مشکلی نيست.
554326	Wipe your tears.	2165620	اشکات رو پاک کن
556617	My daughter caught a cold.	916325	دخترم سرما خورده بود.
556619	What is the tallest mountain in Europe?	916322	مرتفع ترین کوه اروپا چیست؟
559672	Good morning, ladies and gentlemen!	1995513	صبح بخیر، خانم ها و آقایان!
561093	She gets prettier day by day.	916338	او روز به روز زیباتر می شود.
561224	My mother set the table.	916319	مادرم میز را چید.
562014	Christopher Columbus abhorred historical inaccuracies.	655584	کریستف کلمب از اشتباهات تاریخی تنفر داشت.
562850	Do you want a drink?	564186	آیا نوشیدنی می خواهی؟
564200	Sorry, I didn't know you were still here.	564207	ببخشید،من نمی دانستم تو همچنان اینجا بودی.
569640	Anyone may use this dictionary.	1787339	هرکسی می تواند از این دیکشنری استفاده کند.
569786	The supermarket is open Monday through Saturday.	667729	این سوپر مارکت از دوشنبه تا شنبه باز است.
571088	"I see," said the blind man, as he picked up his hammer and saw.	1440456	مرد نابینادر حالیکه چکش و اره رابرمی داشت گفت : می بینم
573670	Klava went to a resort.	866482	کلاوا به یک تفرجگاه رفت.
574450	I'd like to eat a book.	512533	می خواهم یک کتاب بخرم.
574618	Ali is a good person.	566754	علی انسان خوب است.
574624	I am well.	554481	خوبم.
574634	He pushed his nose against the window.	554407	او بینی‌اش را روی پنجره فشار داد.
574636	I worry that I have caught a cold.	554406	انگار سرما خورده‌ام.
576987	You'll get a ticket if you park the car in front of a fire hydrant.	579359	شما جریمه خواهید شد اگر ماشین را جلوی آتش نشانی پارک کنید.
583473	Translation is like a woman. If it is beautiful, it is not faithful. If it is faithful, it is most certainly not beautiful.	828547	ترجمه مانند زن است. اگر زیبا باشد، وفادار نیست. اگر وفادار باشد، مطمئناً زیبا نیست.
586720	Don't take it to heart.	586992	این را به قلبت نزدیک نگاه ندار.
589575	You only live once.	2062488	تو فقط یکبار زندگی می کنی.
602524	Yesterday my uncle bought a dog.	764219	دیروز عمویم سگی خریداری کرد.
604331	Dead dogs don't bite.	1757150	سگهای مرده گاز نمی گیرند.
610687	Just because I'm alone doesn't mean I'm lonely.	2171620	چون تنهام دلیل نمیشه که احساس تنهایی می کنم.
611272	Are you well?	512596	حالت خوبه؟
611823	She's never fallen in love.	1558396	او هیچگاه عاشق نشده است.
612633	Greek and Latin are useful languages. That's why I study them.	1005672	یونانی و لاتین زبان های مفیدی هستند به همین دلیل است که آنها را می خوانم.
613455	Run for your life!	772515	برای زندگی ات بدو!
616073	The mountaineer set out for the summit.	773874	کوهنورد به طرف قله حرکت کرد.
619725	A chain is no stronger than its weakest link.	1044782	استحکام زنجیر به اندازه ضعیف‌ترین حلقه آن است.
619725	A chain is no stronger than its weakest link.	1044787	زنجیر از ضعیف ترین حلقه اش قویتر نیست.
619729	A fool and his money are easily parted.	1044740	تا ابله در جهانه، مفلس در نمیمانه
619729	A fool and his money are easily parted.	1044741	احمق و پولش به راحتی از هم جداشدنی هستن.
620691	Where is the bus stop?	509797	ایستگاه اتوبوس کجاست؟
621157	They're mocking you.	1624222	آنها تو را مسخره می کنند.
624486	Water law is the field of law dealing with the ownership, control, and use of water as a resource.	510293	حقوق آب، شاخه ای از حقوق است که به مالکیت، کنترل و بهره برداری از آب بعنوان یک منبع می پردازد.
624495	Criminal law, also known as penal law, involves prosecution for an act that has been classified as a crime.	624364	حقوق کیفری ، که همچنین بعنوان حقوق جزا نیز شناخته می شود، مستلزم تعقیب کیفری فعلی است که بعنوان جرم طبقه بندی شده است.
624657	Hello, are you well?	508013	سلام، حالت خوب است؟
625902	I put the money into the safe.	2025584	من پول را در گاوصندوق گذاشتم.
625906	I remember that I met the queen.	625915	به خاطر می آورم که ملکه را ملاقات کردم.
631834	Amnesia means "loss of memory".	2174765	بیماری فراموشی به معنای «از دست رفتن حافظه» است.
632704	I have always wanted to become a teacher, but it didn't happen.	632692	من همیشه دوست داشتم معلم شوم، ولی این اتفاق نیفتاد.
633925	We didn't talk yesterday.	633922	ديروز ما حرف نمى زديم.
636928	I got acquainted with him three years ago.	1793857	من سه سال پیش با او آشنا شدم.
640686	She has seven sons.	705477	او هفت پسر دارد.
640855	Two Iranian professors of physics were assassinated.	640856	دو پروفسور فیزیک ایرانی ترور شدند.
644113	To get back to my original point, yesterday I sent the report off to Tokyo.	644121	به منظور برگشتن به مکان اصلی ام... دیروز آن گزارش را به توکیو ارسال کردم.
644115	As always, Keiko showed us a pleasant smile.	644117	مثل همیشه، کیکو یک لبخند خوشایند به ما نشان داد.
644118	Take her to surgery.	644126	او را برای عمل جراحی ببر.
644125	It's rush hour at Tokyo station.	644127	الآن ساعت ازدحام و شلوغی در توکیو است.
644602	My father is oblivious to the emotional pain his abuse caused me.	773868	پدرم توجهی به رنج عاطفی که بر اثر سوءاستفاده در من ایجاد کرده است، ندارد.
647593	One doesn't count the teeth of a gift horse.	647577	دندان های اسب پیشکشی را نمی شمارند.
647613	One does not look a gift horse in the mouth.	647612	اسب پیشکشی را به دندانش نگاه نمی کنند.
651486	I regaled the devil; he gave me a fable.	1567096	من شیطان را خرسند کردم، او به من اسطوره داد.
657165	The book is my best friend.	719944	کتاب بهترین دوست من است.
657625	I really wish to see you today.	647134	خیلی مشتاقم امروز ببینمتان.
657626	I desire a lot to see you today.	647134	خیلی مشتاقم امروز ببینمتان.
657627	That album reminds me of the school happy days.	653934	آن آلبوم مرا به یاد روزهای خوش مدرسه می اندازد.
657630	Such work postulate a lot of patience.	650296	چنین کاری شکیبائی فراوانی را می طلبد.
657957	Exceptions prove the rule.	657951	استثناها قاعده را توجیه می کنند.
658654	There's a garden behind our house.	1758586	باغی پشت خانه ما وجود دارد.
660425	These books are my best friends.	1582702	این کتابها بهترین دوستان من هستند.
661095	Not only his son, but his daughter is also famous.	1601523	علاوه بر پسرش، دخترش نیز مشهور است.
667884	All generalizations are false, including this one.	828521	همه‌ی تعمیم‌دادن‌ها اشتباه‌اند، ازجمله همین یکی.
667910	Get a bicycle. You will not regret it, if you live.	828527	یک دوچرخه بخرید. پشیمان نخواهید شد، اگر زنده بمانید.
667921	It's easy to make friends, but hard to get rid of them.	1888874	دوست شدن آسان است، ولی از شر آنها خلاص شدن سخت است.
667937	The more you explain it, the more I don't understand it.	828536	هرچه بیشتر آن را توضیح می‌دهید، من بیشتر آنرا نمی‌فهمم.
668412	I don't want to write with this pen.	668403	نمی خواهم با این قلم بنویسم.
670832	Looks aren't everything.	772513	ظاهر و قیافه همه چیز نیست.
673190	What a nice idea!	672808	چه ایده خوبی!
673233	This morning Tom had vegetable soup.	672726	امروز صبح تام سوپ سبزیجات خورد.
673755	I pay 30 euros for every visit to the dentist.	773655	هر بار پیش دندانپزشک می‌روم، 30 یورو می‌پردازم.
678644	All truth passes through three stages. First, it is ridiculed. Second, it is violently opposed. Third, it is accepted as being self-evident.	753871	هر حقیقتی از سه مرحله گذر می کند. اول، به سخره گرفته می شود. دوم، شدیداً مورد مخالفت واقع می شود. سوم، به عنوان یک چیز خود-آشکار پذیرفته می شود.
680051	You have to get above a "C" in the class.	1757145	شما باید در این کلاس بالاتر از سی نمره بگیرید.
680097	The bad weather affected his health.	1757129	آب و هوای بد بر سلامت او تاثیر گذاشت.
680325	Mary has her back to us.	908136	مری به ما پشت کرده است.
680335	The government banned cigarette advertising on television.	1609782	دولت تبلغات سیگار در تلویزیون را ممنوع کرد.
680472	She's beating cancer.	1624232	او با سرطان مبارزه می کند.
680607	A crowd of 500 filled the theater.	2179062	جمعیت حدود 500 نفر تو تیاتر بود.
680966	When will you finish your work?	1602092	کی کارت را تمام خواهی کرد؟
681224	Dolphins are very intelligent animals.	1582699	دلفین ها حیوانات بسیار هوشمندی هستند.
681521	Our planet, Earth, is always in motion.	866452	سیاره‌ی ما، زمین، همواره در حرکت است.
681657	The files are in proper order.	805148	فایلها در نظم خوبی هستند.
681824	The purpose of a roundabout is to slow down traffic.	1624228	هدف از مسیر غیرمستقیم، کاهش ترافیک است.
681849	How did he react to the bad news?	752286	او چگونه به خبرهای ناگوار واکنش نشان داد؟
681864	The recession caused many businesses to close.	2188352	رکود باعث بسته شدن خیلی از تجارت ها شد.
682381	The old woman is too weak to get out of bed.	916210	آن پیرزن آنقدر ضعیف است که نمی تواند از رختخواب برخیزد.
687090	They are not used to our customs yet.	1584098	آنها هنوز به رسوم ما عادت نکرده اند.
687488	What's your blog about?	1774471	ووبلاگ شما در چه موردی است؟
687792	Why is dad in the kitchen?	1558415	چرا پدر در آشپزخانه است؟
688008	You've put on weight.	2171609	چاق شدی.
688026	His appearance and behavior made me ashamed of him.	1582697	ظاهر و رفتار او مرا شرمنده کرد.
688407	I can't remember her name.	688476	من نمی توانم نام او را به خاطر آورم.
688407	I can't remember her name.	689209	نمیتوانم اسم او را به یاد آورم.
689015	Peas and carrots are common ingredients in soups.	1438193	نخود و هویج از افزودنی‌های متداول سوپ هستند.
689018	I was born in 1972.	1757155	من در سال 1972 به دنیا آمده ام.
689895	Can you please watch my bag?	1558376	لطفاً، می توانید مراقب کیف من باشید؟
689898	Who stole something from my bag?	866487	چه کسی چیزی را از کیف من دزدیده است؟
692207	I like to travel.	1044541	دوست دارم مسافرت کنم
694434	My father is going to China.	3498171	پدرم به چین می‌رود.
695367	What is written on the road sign? - ONE WAY.	917649	بروی تابلو راهنمایی و رانندگی چه نوشته شده است؟ -یک طرفه.
696340	I want to go with you, but I'm broke.	1567933	می خواهم با تو بیایم، اما پول ندارم.
705417	The world is a grand ball in which everyone wears a mask.	705502	دنیا یک مهمانی بزرگ است که در آن هر کس ماسکی بر صورت دارد.
705552	That girl who's wearing a scarf is a virgin.	705553	آن دختر که روسری دارد باکره است.
705555	They behave towards Muslims in a way in which no Muslim would behave towards an unbeliever.	705556	آنها طوری با مسلمانان رفتار می کنند که هیچ مسلمانی اینگونه با کافری رفتار نمی کند.
