3836465	It's a bit early to be drinking, isn't it?	3839854	کمی برای نوشیدن زود است، این طور نیست؟
3836451	My racial composition is just a camouflage.	3839858	ترکیب نژادی ام تنها یک استتار است.
3836273	Which color do you prefer?	3839859	چه رنگی دوست داری؟
3836273	Which color do you prefer?	3839860	تو چه رنگی دوست داری؟
3836151	With friends like Tom, one doesn't need any enemies.	3839861	با دوستی مثل تام کسی احتیاج به دشمن ندارد.
1282	Muiriel is 20 now.	3840007	حالا موریل ۲۰ ساله است.
1283	The password is "Muiriel".	3840008	کلمه عبور موریل است.
1286	I'm at a loss for words.	3840011	در کلام نمی گنجد.
1288	I just don't know what to say.	3840013	نمی دانم چه بگویم.
436541	I don't know what to say.	3840013	نمی دانم چه بگویم.
1291	Is it a recent picture?	3840022	آیا این تصویر جدید است؟
1292	I don't know if I have the time.	3840025	نمی دانم وقت خواهم داشت یا نه.
1296	You are in my way.	3840027	شما راه مرا سد کرده اید.
1298	This will cost €30.	3840029	میشه ۳۰ یورو.
1299	I make €100 a day.	3840032	من روزی صد یورو درآمد دارم.
1301	It's because you don't want to be alone.	3840038	وضع این طور است چون نمی خواهی تنها باشی.
1314	You're so impatient with me.	3840041	با من بسیار بی تحمل هستید.
1316	I once wanted to be an astrophysicist.	3840045	می خواستم یک اخترفیزیک دان باشم.
1317	I never liked biology.	3840047	هیچ وقت زیست شناسی دوست نداشتم.
1318	The last person I told my idea to thought I was nuts.	3840049	آخرین کسی که ایده ام را شنید فکر کرد دیوانه ام.
1319	If the world weren't in the shape it is now, I could trust anyone.	3840052	اگر کار جهان این طور که هست نبود می توانستم به هر کس اعتماد کنم.
1320	It is unfortunately true.	3840056	متاسفانه صحت دارد.
1321	They are too busy fighting against each other to care for common ideals.	3840064	آنها به قدری مشغول نزاع با یکدیگراند که برای رسیدن به مشترکات مجالی نیست.
1322	Most people think I'm crazy.	3840067	اغلب مردم فکر میکنند من دیوانه ام.
1323	No I'm not; you are!	3840071	من نیستم؛ خودتی!
1325	He's kicking me!	3840075	او انگولکم می کند.
1326	Are you sure?	3840076	مطمئنی؟
1328	Oh, there's a butterfly!	3840080	اوه، آنجا یک پروانه هست.
1329	Hurry up.	3840084	بدو.
1332	For some reason I feel more alive at night.	3840086	بنا به دلایلی شب ها سرزنده تر ام.
1333	It depends on the context.	3840088	بستگی به شرایط دارد.
1334	Are you freaking kidding me?!	3840093	منو دست انداختی؟!
1335	That's the stupidest thing I've ever said.	3840096	این احمقانه ترین چیزی است که تا کنون گفته ام.
1336	I don't want to be lame; I want to be cool!!	3840100	نمی خواهم سطحی باشم؛ می خواهم با حال باشم!!
1337	When I grow up, I want to be a king.	3840103	می خواهم وقتی بزرگ شدم شاه شوم.
1339	I'm so fat.	3840112	من خیلی چاق ام.
1340	So what?	3840116	بعدش چی؟
1341	I'm gonna shoot him.	3840121	با تیر او را خواهم زد.
1343	I'm just saying!	3840124	فقط دارم می گویم.
1344	That was probably what influenced their decision.	3840457	احتمالا همین روی تصمیم شان تاثیر گذاشته.
1345	I've always wondered what it'd be like to have siblings.	3840458	من همیشه خیال می کردم برادر و خواهر داشتن چگونه است.
1346	This is what I would have said.	3840465	این همان چیزی است که من می گفتم.
1347	It would take forever for me to explain everything.	3840468	اگر بخواهم همه اش را توضیح دهم تا ابد طول خواهد کشید.
1348	That's because you're a girl.	3840469	این به خاطر دختر بودن تو است.
1349	Sometimes I can't help showing emotions.	3840470	بعظی اوقات نمی توانم جلوی احساساتم را بگیرم.
1352	I don't intend to be selfish.	3840472	نمی خواهم خودخواه باشم.
1354	How many close friends do you have?	3840476	چند تا دوست صمیمی داری؟
1355	I may be antisocial, but it doesn't mean I don't talk to people.	3840481	ممکن است اجتماعی نباشم ولی این به این معنی نیست که با مردم صحبت نمی کنم.
1357	I think it is best not to be impolite.	3840485	گمان می کنم بهتر این است که بی ادب نباشم.
1358	One can always find time.	3840487	همیشه وقت پیدا می شود.
1359	I'd be unhappy, but I wouldn't kill myself.	3840488	ناراحت خواهم بود ولی خودم را نخواهم کشت.
1360	Back in high school, I got up at 6 a.m. every morning.	3840489	دبیرستان که بودم هر صبح ۶ بیدار می شدم.
1361	When I woke up, I was sad.	3840490	بیدار که شدم غمگین بودم.
1363	I thought you liked to learn new things.	3840492	فکر کردم دوست داری چیز های تازه یاد بگیری.
1364	Most people write about their daily life.	3840493	بیشتر مردم در مورد زندگی روزمره شان می نویسند.
1366	In order to do that, you have to take risks.	3840496	برای انجام این کار باید خطر کنی.
1367	Every person who is alone is alone because they are afraid of others.	3840497	هر که تنهاست، تنهاست چون از دیگران می ترسد.
1368	Why do you ask?	3840498	چرا می پرسی؟
1369	I am not an artist. I never had the knack for it.	3840499	من هنرمند نیستم. هیچ وقت ذوق اش را نداشتم.
1370	I can't tell her now. It's not that simple anymore.	3840501	آلان نمیتوانم به اش بگویم. ماجرا دیگر به آن سادگی نیست.
1372	Whenever I find something I like, it's too expensive.	3840502	هر وقت از چیزی خوش ام می آید خیلی گران است.
1373	How long did you stay?	3840503	چه مدت ماندی؟
1374	Maybe it will be exactly the same for him.	3840504	شاید برای او هم دقیقا همین طور است.
1375	Innocence is a beautiful thing.	3840506	عصمت چیز زیبایی است.
1376	Humans were never meant to live forever.	3840509	انسان ها هرگز قرار نبوده تا ابد زندگی کنند.
1378	I think I have a theory about that.	3840518	گمان کنم نظری راجع به آن دارم.
1380	You are saying you intentionally hide your good looks?	3840519	منظورت این است که عامدانه خوشگلی ات را پنهان می کنی؟
1382	If anyone was to ask what the point of the story is, I really don't know.	3840520	اگر کسی بپرسد اصل داستان چه بود، من واقعا نمی دانم.
1383	I didn't know where it came from.	3840521	نمیدانم از کجا آمد.
1385	This is not important.	3840523	این مهم نیست.
1386	I didn't like it.	3840524	خوشم نیامد.
2908761	Sorry, I'm not interested.	3840852	ببخشید، دوست ندارم.
1401868	I visited Paris a long time ago.	3840857	من خیلی وقت پیش پاریس بودم.
3121870	The cat's kittens are cute.	3840865	بچه های گربه با مزه اند.
15845	Do you know who he is?	3840873	او را می شناسی؟
3185399	Tom stayed in Boston for a short while.	3840874	تام مدت کوتاهی در بوستون ماند.
2241696	We've outrun them.	3840876	بُردیمشون.
2725816	She probably studied in France, as she speaks French fluently.	3840878	احتمالا فرانسه درس خوانده است که این طور روان فرانسه حرف می زند.
3723277	It had to come from somewhere.	3840889	بالاخره باید از یک جایی می آمد.
1360038	I read the entire works of Milton over the holiday.	3840905	من تمام آثار میلتون را طی تعطیلات خواندم.
17470	I'll lend you my notebook.	3840908	من دفتر یادداشتم را به ات قرض می دهم.
1397	I won't ask you anything else today.	3841995	امروز دیگر از تو چیزی نخواهم خواست.
1398	It may freeze next week.	3841996	ممکن است هفته دیگر یخ بندان باشد.
1399	Even though he apologized, I'm still furious.	3841997	با اینکه او معذرت خواسته من هنوز عصبانی ام.
1400	The police will get you to find the bullets.	3841998	پلیس تو را مجبور خواهد کرد تا گلوله ها را پیدا کنی.
1401	Thanks for having explained to me at last why people take me for an idiot.	3841999	ممنونم از اینکه بالاخره به من توضیح دادید چرا مردم من را احمق فرض می گیرند.
1402	That wasn't my intention.	3842000	قصد ام این نبود.
1403	Thanks for your explanation.	3842001	از توضیحات تان ممنونم.
1406	If you didn't know me that way then you simply didn't know me.	3842002	اگر تو من را آنقدر نمی شناختی پس من را اصلا نمی شناختی.
1408	I don't know what you mean.	3842003	منظورت را نمی فهمم.
1409	My computer has got to be useful for something.	3842004	کامپیوترام باید به درد یک چیزی بخورد.
1410	You wanted to tell me about freedom?	3842005	می خواستی با من از آزادی بگویی؟
1411	Uh, now it's really weird...	3842006	آه، الآن دیگه خیلی چت شد...
1412	If I wanted to scare you, I would tell you what I dreamt about a few weeks ago.	3842007	اگر قصد ام ترساندن ات بود رویای چند هفته پیش ام را برای ات می گفتم.
1414	There are many words that I don't understand.	3842008	کلماتی بسیاری هست که نمی فهمم.
1416	You're really not stupid.	3842009	تو واقعا احمق نیستی.
1417	I need to ask you a silly question.	3842010	باید یک سوال احمقانه ازت بپرسم.
1418	I don't know how to demonstrate it, since it's too obvious!	3842011	آنقدر واضح است که نمی دانم چه طور نشان اش بدهم.
1421	No one will know.	3842013	کسی نخواهد فهمید.
1423	It seems interesting to me.	3842015	به نظرم جذاب می آید.
1425	I like candlelight.	3842017	من نور شمع را دوست دارم.
1426	What did you answer?	3842018	تو چه جواب دادی؟
1428	It's too bad that I don't need to lose weight.	3842023	حیف که لازم نیست لاغر شوم.
2089	He's sleeping like a baby.	3842028	خوابه خوابه.
1967	When both girls told John they had feelings for him, he was in a quandary as to which girl he should be with.	3842214	وقتی هر دو دختر به جان گفتند که به او علاقه مندند، او مردد بود که باید با کدام یک از آنها باشد.
62498	Ken beat me at chess.	3842653	کن من را در شطرنج برد.
3842529	I want a new dog.	3842661	من سگی جدید می خواهم.
3842528	She wants a new dog.	3842662	او سگی جدید می خواهد.
3842402	There is another tunnel up there.	3842664	تونل دیگری آنجا هست.
3842394	This area is hotter than the Sahara desert.	3842665	اینجا از صحرا هم گرم تر است.
3842046	What will you do on New Year's Day?	3842666	در روز سال نو چه خواهی کرد؟
3842038	The elder gods are waking up.	3842667	خدایان پیرتر در حال بیدار شدن هستند.
3841987	I speak five languages.	3842668	من به پنج زبان صحبت می کنم.
3841954	Don't offend anyone!	3842724	به کسی حمله نکن!
3841952	Does this offend you?	3842729	آیا این به تو بر می خورد؟
3841922	What are you going to do when you graduate?	3842731	وقتی فارغ التحصیل شدی می خواهی چه کنی؟
3841921	Mary shielded her eyes from the sun.	3842734	مری صورت اش را از آفتاب پوشاند.
18526	He became rich.	3842736	او ثروتمند شد.
688407	I can't remember her name.	3842738	نام او را به یاد نمی آورم.
2256882	That's completely irrelevant.	3842739	این به کل بی ربط است.
3841836	I love to be alone. I never found the companion that was so companionable as solitude.	3842747	من عاشق تنهایی ام. هرگز همراهی همدم تر از تنهایی نیافتم.
3840494	Logic will get you from A to B. Imagination will take you everywhere.	3842759	منطق تو را از الف به ب خواهد برد. خیال تو را به همه جا خواهد برد.
3840154	Everything isn't always simple in life.	3842761	همیشه همه چیز در زندگی ساده نیست.
3840026	How did the dog bite the man?	3842764	سگ چطور مرد را گرفت؟
3840024	Which car did Tom choose?	3842767	تام کدام ماشین را انتخاب کرد؟
3840019	I want to drink some tea or coffee.	3842769	می خواهم کمی چای یا قهوه بنوشم.
3840014	They are foolish.	3842776	آن ها احمق اند.
3839942	All that read this can read.	3842787	هرکه این را خواند خواندن می داند.
3839922	We remained paralyzed for hours in a traffic jam.	3842792	ما ساعت ها در ترافیک فلج ماندیم.
3839914	Is this your real name?	3842795	آیا این نام واقعی تو است؟
3842848	To hurt a friend is to do what the enemy wants.	3040931	دل دوستان آزردن، مراد دشمنان برآوردن است.
2245359	Don't look surprised.	3843805	ادای آدمهای متعجب را در نیاور.
898538	Is it OK to feed my dog lettuce?	3843810	اشکال ندارد به سگم کاهو بدهم بخورد؟
2025959	You might want to take a look at this.	3843813	بهتر است نگاهی به این بیندازی.
367995	Their names have escaped me.	3843817	نام‌هایشان را فراموش کرده‌ام.
265786	Some young Japanese people prefer being single to being married.	3843818	بعضی جوانان ژاپنی ترجیح می‌دهند مجرد باشند تا اینکه ازدواج کنند.
2978390	No clouds were in the sky.	3843829	در آسمان ابری نبود.
2978407	When I met Anka in Bucharest she was studying.	3843831	وقتی آنکا را در بخارست ملاقات کردم مشغول درس خواندن بود.
3734297	Tom wants to work in a hospital.	3843833	تام می‌خواهد در بیمارستان کار کند.
42067	It's free of charge.	787174	مجانی است.
3522021	I want to spend more time with Tom.	3843841	می‌خواهم وقت بیشتری با تام بگذرانم.
3522022	I never get to spend any time with Tom.	3843843	هیچوقت نمی‌شود که با تام وقت بگذرانم.
3522023	I just need a minute alone with Tom.	3843852	می‌خواهم فقط یک دقیقه با تام تنها باشم.
3522025	Everyone knows you're in love with Tom.	3843857	همه می‌دانند که تو عاشق تام هستی.
255708	I can't sing as well as Mary did.	3843859	من نمی‌توانم به خوبیِ ماری آواز بخوانم.
3403393	Tom is making stew for us.	3843860	تام دارد برای ما خورش می‌پزد.
3163264	The trail was not clearly marked.	3843861	مسیر دقیق مشخص نشده بود.
1273507	The weather report said that there will be thunderstorms tomorrow evening.	3843865	گزارش هواشناسی گفت که فردا عصر طوفانی خواهد بود.
65959	It doesn't matter when you come.	3843874	مهم نیست که کِی می‌آیی.
65959	It doesn't matter when you come.	3843875	مهم نیست که کِی می‌آیید.
65959	It doesn't matter when you come.	3843876	مهم نیست کِی می‌آیی.
3201796	Tom told me that the trip was off.	3843880	تام به من گفت که سفر لغو شده است.
3201797	Tom told me that he was very busy.	3843882	تام به من گفت که سرش خیلی شلوغ است.
3201798	Tom told me that he had a problem.	3843883	تام به من گفت که مسئله‌ای برایش پیش آمده است.
3201798	Tom told me that he had a problem.	3843885	تام به من گفت که براش مشکلی پیش اومده.
3844667	I live in the Andromeda Galaxy.	3844671	من در کهکشان آندرومدا زندگی می کنم.
3844666	The Andromeda Galaxy is my home.	3844672	کهکشان آندرومدا خانه من است.
3629983	Ah!	3844673	آه!
3844664	That isn't cool.	3844674	جالب نیست.
3844662	That's definitely a boat.	3844675	آن قطعا یک قایق است.
3844661	I'll eat anything.	3844676	من هر چیزی خواهم خورد.
3844634	Ah! Snow!	3844677	آه! برف!
3844581	I can't get this container open...	3844678	نمی توانم در این ظرف را باز کنم.
3844435	We must go there at least once a year.	3844679	ما باید حد اقل سالی یک بار به آنجا برویم.
3844006	Aristotle thought women were of weak nature and easily overtaken by their emotions.	3844680	ارسطو می پنداشت زنان طبیعتی ضعیف دارند و به سادگی در دستان احساسات شان رها می شوند.
3844002	Unlike Aristotle, Plato deemed women fit for the highest of positions in his republic.	3844681	برعکس ارسطو، افلاطون زنان را منطبق با بالاترین موقعیت ها در جمهوری اش می دید.
3843998	The truth is lived, not taught.	3844682	حقیقت زیستنی است نه آموختنی.
1568774	It's hard.	3844683	سخت است.
3843542	Miraculously, none of them died.	3844684	به طرز معجزه آسایی هیچ کدام نمردند.
3843484	Inshallah, soon we'll be home.	3844685	اگر خدا بخواهد به زودی به خانه خواهیم رسید.
3846747	A blank check? You only see those in movies.	3846804	یک چک سفید‌امضا؟ چنین چیزی را فقط توی فیلم‌ها می‌توانی ببینی.
3846414	I wish you'd come last night.	3846819	ای کاش دیشب آمده بودی.
3846404	If I had known, I would have done it.	3846820	اگر می‌دانستم، انجامش داده بودم.
2044729	I'm so happy to see you again.	3846822	خیلی خوشحالم که دوباره می‌بینمت.
3842529	I want a new dog.	3846823	یک سگ جدید می‌خواهم.
3846297	I know that one day you'll be grateful to me.	3846824	می‌دانم که یک روز از من متشکّر می‌شوی.
3846289	We do not respect the environment as much as we should.	3846826	آن قدر که باید به طبیعت احترام نمی‌گذاریم.
3846287	I must have left them on my desk.	3846829	باید آن‌ها را روی میزم جا گذاشته باشم.
3846201	Close the door!	3846830	در را ببند!
3846043	Lately, he's achieved some pretty good results.	3846832	اخیراً نتایج خیلی خوبی به دست آورده است.
30621	If I were you, I wouldn't do it.	3846833	اگر جای تو بودم، انجامش نمی‌دادم.
3844689	Ouch! I bit my tongue.	3846835	آخ! زبانم را گاز گرفتم.
3847295	He's a snitch!	3847337	او خبر چین است!
3847289	He isn't coming today.	3847339	امروز نمی‌آید.
3847285	He is a pervert.	3847341	او منحرف است.
1184270	God forbid!	3847343	خدا نکند!
3847264	Geez! Are you deaf?	3847344	یا خدا! کری؟
3847198	Raising a daughter is like watering your neighbour's garden.	3847401	دختر بزرگ کردن مثل آب دادن باغچهٔ همسایه است.
3847013	Excuse me, I couldn't help laughing.	3847402	ببخشید، نتوانستم جلوی خنده‌ام را بگیرم.
1310	I always liked mysterious characters more.	3847405	همیشه شخصیت‌های مرموز را بیشتر دوست داشتم.
2044402	Tom looks happy.	3848711	تام خوشحال به نظر می‌رسد.
3847338	It may be difficult, but not impossible.	3848713	ممکن است سخت باشد، ولی غیر‌ممکن نیست.
3845654	Spartacus was a Roman slave.	3848715	اسپارتاکوس یک بردهٔ رومی بود.
3845659	But why is French so difficult?	3848718	امّا چرا فرانسوی این قدر سخت است؟
3843979	Solitude is independence.	3848738	انزوا استقلال است.
3826669	I don't trust you anymore.	3848741	دیگر بهت اعتماد ندارم.
3850919	I left my credit card at home.	3850961	کارت اعتباریم را خانه جا گذاشتم.
3850801	We must find her.	3850972	باید پیدایش کنیم.
3850786	We must find him.	3850972	باید پیدایش کنیم.
3848601	I am unable to do more!	3850975	بیشتر از این نمی‌توانم انجام بدهم!
3848578	I am unable to do more.	3850977	بیشتر از این نمی‌توانم انجام بدهم.
3847846	They criticized each other.	3850978	از یکدیگر انتقاد کردند.
3849996	Samara Morgan never sleeps.	3850981	سامارا مورگان هیچ وقت نمی‌خوابد.
3850953	Which do you like better, Coca-Cola or Pepsi?	3850982	کدام را دوست داری، کوکا‌کولا یا پپسی؟
3850804	We must find them.	3850983	باید پیدایشان کنیم.
3178475	We must find Tom.	3851003	باید تام را پیدا کنیم.
3178477	We must find it.	3850972	باید پیدایش کنیم.
3851000	Please laugh!	3851098	بخند لطفاً!
3851173	I'm not wearing that dress.	3851203	من آن لباس را نمی پوشم.
3754654	Stop crying!	3851204	گریه را بس کن!
3850960	Which do you prefer, Coke or Pepsi?	3851206	کدام را ترجیح می دهی، پپسی یا کوکا؟
3850971	Which do you like better, Coke or Pepsi?	3851209	کدام را بیشتر دوست داری، پپسی یا کوکا؟
3853833	Each of us should plant a tree.	3853872	هر یک از ما باید یک درخت بکاریم.
3853831	This is my first time speaking German with a German person.	3853875	اوّلین بار است که با یک آلمانی به آلمانی صحبت می‌کنم.
3853793	I've already tried.	3853876	قبلاً سعی کرده‌ام.
3853699	Tom is the only one here who doesn't know Mary.	3853883	تام تنها کسی است این جا که مری را نمی‌شناسد.
3853698	Tom is the one who gave me this bicycle.	3853885	تام کسی است که این دوچرخه را به من داد.
3853696	Tom is the one who showed me how to do it.	3853886	تام کسی است که به من نشان داد چه طور انجامش بدهم.
3853694	Tom is the one who told me when the meeting would be.	3853888	تام کسی است که به من گفت زمان ملاقات کی خواهد بود.
3853693	Tom is the one who told me that Mary didn't like me.	3853889	تام کسی است که به من گفت مری دوستم ندارد.
3853692	Tom is the one who told me that I should study French.	3853890	تام کسی است که به من گفت باید فرانسوی یاد بگیرم.
3853689	Tom is the one who told me why I needed to go to Boston.	3853893	تام کسی است که به من گفت چرا باید به بوستون بروم.
3853688	Tom is the one who told me who to give it to.	3853894	تام کسی است که به من گفت به کی بدهمش.
3853687	Tom is the one who told me what to do.	3853895	تام کسی است که به من گفت چه کار کنم.
3853250	Yes, I certainly agree.	3853898	بله، قطعاً موافقم.
3852974	Last year I watched no less than fifty films.	3853901	سال قبل کمتر از پنجاه فیلم ندیدم.
3852973	I am not satisfied with what I have done.	3853903	از چیزی که انجام داده‌ام راضی نیستم.
3852971	I abandoned my plans.	3853906	برنامه‌هایم را وِل کردم.
3852691	When I think of you, only one thing comes to mind: arrogance.	3853914	وقتی بهت فکر می‌کنم، فقط یک چیز به ذهنم می‌آید: تکبّر.
3852684	It's your terrible arrogance that makes you totally unbearable.	3853921	تکبّر وحشتناکت هست که کاملاً غیر‌قابل‌تحمّلت می‌کند.
3852670	If I were in your position, I wouldn't do that.	3853923	اگر جای تو بودم، آن کار را نمی‌کردم.
3852627	In this area, sandstorms can last up to four days.	3853924	در این منطقه، طوفان‌های شن تا چهار روز می‌تواند طول بکشد.
3851860	Add this to my bill.	3853927	این را به صورت‌حسابم اضافه کن.
3851604	Tom was attending an earthquake conference when Mary called him.	3853933	تام در یک همایش زلزله بود وقتی مری با او تماس گرفت.
1773400	You are such a liar!	3853935	چه دروغگویی هستی!
3855899	I accused her of having stolen the bike.	3855909	به دزدیدن دوچرخه متّهمش کردم.
3855898	I accused him of having stolen the bike.	3855909	به دزدیدن دوچرخه متّهمش کردم.
3855896	You accused her of having stolen the bike.	3855912	به دزدیدن دوچرخه متّهمش کردی.
3855865	You accused him of having stolen the bike.	3855912	به دزدیدن دوچرخه متّهمش کردی.
3855893	He accused her of having stolen the bike.	3855915	به دزدیدن دوچرخه متّهمش کرد.
